comment_text,rating,like_count,user_name,movie_id,sentiment,sentiment_label,movie_name
"身份认同长久以来被父权社会描述成无病呻吟的小事，不成体统的歪道；从前的哪吒们，动仄削骨还父削肉还母，投胎再造是他们逃离家庭歧视和社会指摘重获自由的唯一方法；

如果明天，我们每个人都可能是被主流价值观霸凌的没有三头六臂的哪吒；那么今天，我们还要不要作嘲笑一切“怪物”的庸人，镇压一切“妖孽”的玲珑塔呢？",5.0,62,严荼,26794435,1,Positive,哪吒之魔童降世
"说烂片预订那大叔，动漫非得拍给小孩看？你不接受设定别代表大家，还有哪吒啥货色但绝不是你想的那种设定，好好多读书，再回去好好琢磨下封神。
观后:吹爆这片，今年最佳国漫。",5.0,355,吉尔伽美什,26794435,1,Positive,哪吒之魔童降世
无因的反叛，对着空气和闪电的怒吼。,3.0,135,水怪,26794435,2,Neutral,哪吒之魔童降世
明明惹祸的是李家，遭殃的是百姓，而他们最后那一跪，未免太奴性了,4.0,59,司徒苤茢,26794435,1,Positive,哪吒之魔童降世
终于打破了《大圣》《白蛇》拘泥于“为国风而国风”的短板，硬件条件满足的情况下专注于塑造人物性格和“逆天改命”的全民情绪点，是近几年《封神》IP改编最满意的一次，《悟空传》请你过来看看人家是怎么拍的。另外哪吒身上看到了漩涡鸣人的影子，不知饺子导演是否也是《火影》迷呢？,5.0,79,壹安²,26794435,1,Positive,哪吒之魔童降世
哪吒和敖丙，其实就是小鱼儿与花无缺。魔丸和灵珠算一体两面的双胞胎，不同成长环境造就了不同的性格，一个是恶人谷魔星，一个是移花宫传人。小鱼儿不恶，花无缺却被恶人迷了心智，最后被设计打个你死我活。,3.0,45,大奇特(Grinch),26794435,2,Neutral,哪吒之魔童降世
制作ok啦，故事这么改也不是不行，反正也不敢照着原本拍。改编的重点是把反抗对象抽象化，不反体制只反命运，最后落到“做自己”，这其实是妥协。虽然能理解，但也是妥协。本质上，没有剔骨割肉和重塑肉身这一破一立的哪吒，是没有意义的。要看身为异类如何自我认同，不如看X战警啊。,3.0,109,鬼腳七,26794435,2,Neutral,哪吒之魔童降世
主创有才华，陈词滥调的神话故事也能拍的圆润饱满，有血有肉；导演没审美，再多投资，再好的题材，再大牌的明星资源，拍出来也让人皱眉，只能靠着争议性，话题性哄骗观众的钱，然后安慰自己，赚到就是成功的。万马齐喑究可哀，中国一直不缺有才华有实力有心思的创作者，缺的是机会，是社会资源的不公平分配。,5.0,63,王俊俊,26794435,1,Positive,哪吒之魔童降世
这难道不是anti我命由我不由天吗？所以对哪吒这个主题的现代解读就是反叛少年回归家庭、父慈子孝、乖乖接受天罚。他的改变根本不是因为他想做自己，就只是想融入主流社会得到智熄百姓的认可而已。反抗个JB？这不就跟招安了一样恶心嘛。害，还挺符合主流价值观的。,0.0,42,Alan Sleep,26794435,0,Negative,哪吒之魔童降世
避重就轻间完成了从“父母皆祸害”到“历史进程靠个人奋斗”的温和改良，将哪吒原有的玉石俱焚般的刚烈变成了更符合广泛受众的取向；广泛地吸取了欧美动画长片的剧作模式和无厘头的幽默节点设置，大量的小聪明聚合体。,4.0,24,托尼·王大拿,26794435,1,Positive,哪吒之魔童降世
段子少点就好了,3.0,40,qw0aszx,26794435,2,Neutral,哪吒之魔童降世
md 这么垃圾的片子还天天上热门 看了都生气 都9102了还在拍这种只会空喊口号连小学生看了都嫌丢人的电影 还8.5分 也配？要是再冲进top250 我立马注销豆瓣 从此一生黑,1.0,65,马恩斯·加喵,26794435,0,Negative,哪吒之魔童降世
特别难过，如果是普通的动画片做成这样，肯定给五星的了，可惜是哪吒。哪吒是非常罕见的反抗君权父权的古典题材，现在突然又变成歌颂父权（爸爸瞒着你做了XX实际是为了你好）的东西，彷佛心底的一颗明珠被挖出来打扮得花枝招展再放点屎屁尿去接客一样。我能明白当年悲壮震撼的哪吒脑海不可能再重制上映，即使上映了也会被父母投诉到死，只是。。。单纯很难过而已。,2.0,137,千鸟欢喜天,26794435,0,Negative,哪吒之魔童降世
主角的戏写得很聪明，尤其做出来了哪吒和敖丙的关系，令人接受容易又不落俗套。但节奏是一大问题，不如本身的技术那样流畅。思想上要比大圣成熟，但没有大圣那样锋利，我个人不喜欢的是配音部分。题外话，我在漫威中看到了世界上那么多维护世界和平保持公共安全的各路超英，可是在中国的这样的动画里永远看到的都是反面的神仙，查无此人的元始天尊，阴险狡猾的申公豹，缺乏专业的太乙真人，玩忽职守的结界神，这些代表着上层的人总是要被塑造成这样的轻浮与标签化，也许一部分暗合了世人的想象，但真的并不真实生动。这个电影没有在任何一个其他的角色上做出真正丰满立体的设定，都是在一个维度里做得规范踏实，所以最后这个可怜天下父母心感人却不深刻。,3.0,47,Morning,26794435,2,Neutral,哪吒之魔童降世
火然，意思是要火的样子。比大圣厉害多了。冰与火。不虐(让再长大点再来虐吧，先美好童年先)，从头笑到彩蛋，踢毽子感人。丑萌喜欢。坐等好影院屏幕二刷。3D记得带上眼镜儿~火，火个小哪吒吧,5.0,504,深夜声噎,26794435,1,Positive,哪吒之魔童降世
让人物智商下线来推动剧情是最低级的剧作方式。这个故事就是靠着犯蠢来推动剧情的，浪费了有趣的创意和设定。就算最后口号喊得再响亮也盖不住空洞的故事。导演说为了避免反派脸谱化做了很多设定，恰恰最大的反派陈塘百姓是最脸谱的，跟银河一个德行，群众就是恶的化身。,3.0,158,喵老师2333,26794435,2,Neutral,哪吒之魔童降世
喜剧部分全程滥梗，角色设定也接受无能，制作完成度确实可以，基本抵消。观感其实跟银河差不多，审美相当，只是方向不同。,3.0,116,皮革业,26794435,2,Neutral,哪吒之魔童降世
"比白蛇缘起更成熟，国漫又进步了！！！又燃又有内核，打戏，画面，人物表情，人物性格的塑造和心理建设，都堪称完美。
“是魔是仙，我自己说了才算。”“我命由我不由天”
“若命运不公，就和它斗到底!”
天生倔强，打破成见，这，就是哪吒！",5.0,416,开启学霸模式,26794435,1,Positive,哪吒之魔童降世
好厕的审美，哪吒爆改父爱如山，可怜天下父母心，这个跟孙悟空棒打鸳鸯拆散唐僧和白骨精有什么区别…,1.0,86,种树,26794435,0,Negative,哪吒之魔童降世
敖丙好帅好苏啊……我对这种类型的男二简直无法抵抗……,5.0,39,红豆♥,26794435,1,Positive,哪吒之魔童降世
“作为新晋的国产动画旗手，我们希望新晋的黑马不止于利用好莱坞式的叙事方式来讲述东方神话，而是希望它可以在主题、在美学、在技术上有更加深入的开拓和探索，而不仅仅只是传达单一讯号——我们和好莱坞的差距，正越来越小。”,3.0,66,电影拼图,26794435,2,Neutral,哪吒之魔童降世
这件万龙甲啊，太沉重了。敖丙带着全体龙族的希望，义字当先就这样冲进天劫了，最后只剩一缕小烟魂。实名请求封神宇宙给我龙族一个好结局，别再虐了。个人感觉龙族副线比主线更出彩。加油啊，封神宇宙。,4.0,48,木由,26794435,1,Positive,哪吒之魔童降世
"为了迎合市场拍大团圆合家欢主流电影，“削骨还父，削肉还母”都没了，哪吒也就不再是哪吒，只是打着“哪吒”旗号讨好广大家长满足各位中二孩童的低幼片罢了。
更别说其中各种尴尬的笑话，还有那句“我命由我不由天”。
看到一条评论写得好：“大圣归来不再大闹天宫，魔童降世不再闹海自刎。是时代的反骨逆鳞被拔除了，我们都是龙宫里的老龙。”",3.0,35,手肿咋办,26794435,2,Neutral,哪吒之魔童降世
看完此刻真想把我买的2的票退了。这部动画不是应该有很多小朋友看的吗？为什么很多油腻的笑点……为什么口吃会被做成贯穿全片的笑点？有一个出现几次的尖叫胡子大汉，弹幕要么是骂「臭娘们儿」，要么是说「这也得搞个LGBTQ，烦人」。我如果将来有小孩，我不想让我的孩子从小看这种教人怎么嘲笑歧视别人的动画。一切最后归于一句我命油我不由天。有些能共情哪吒曾经被人误解孤立排挤的人，却在同时笑话口吃的人和厌恶声音很尖的胖男人。最后的大吼「这是爹教我的道理！！」就……好的爹也有很多，喜欢爹的故事可以新写一个，非得洗白李靖这个爹吗？哪吒这个形象最鲜明的「析肉还母，析骨还父」没有了。唯一会心一笑的只有《三维弹球》那个画面，叹息。,2.0,44,燕仰,26794435,0,Negative,哪吒之魔童降世
冥冥中有股党性...,3.0,31,XU,26794435,2,Neutral,哪吒之魔童降世
如果我们国产影片的对白台词继续这样低级趣味的尴尬下去；如果我们树立的国产男孩形象再继续走这种小大人、没教养、我最牛逼、目中无人的路线；如果我们继续用今天影视圈的品位和文化底蕴糟践神话和历史人物，那么电影院有一天也会成为工体，成为一个不能带孩子沾染的地方。,1.0,278,KURE,26794435,0,Negative,哪吒之魔童降世
咱也不敢说，咱也不敢问,3.0,41,文森特九六,26794435,2,Neutral,哪吒之魔童降世
又一部好设定、烂剧本的国漫典型，长板效应在暑期档再次戳中了观众痛点——《哪吒》的剧作缺陷和胜利曲线几乎和《大圣归来》如出一辙。讲的是逆天改命和打破成见，中式超级英雄的反叛内核总能和时代情绪呼应。把全副精力都放在视效和燃点上，可幽默感是尴尬且失效的，故事细节和转折也难以推敲，从而让亲情与友情的元素变得非常羸弱。回想这些年的国漫爆款，独树一帜的还数《大护法》。,3.0,44,晚不安,26794435,2,Neutral,哪吒之魔童降世
故事讲得很出彩，实现得也很好。但有一些对白好像刻意的降低了品质感，我觉得不必要。总之加油。,4.0,24,草威,26794435,1,Positive,哪吒之魔童降世
耐飞上看了。剧情和人物塑造都非常失败，我命由我不由天的主题，表现极其生硬，填鸭一样把这个意思强加给观众。前半部生硬搞笑，后半部主题没能升华。哪吒自始至终是一个非常自私的人，他的动机根本不是拯救苍生，而是证明自己不是坏蛋。证明不了，那就破罐破摔。至于说动画特效，也就是好莱坞直接DVD发行的3D动画片水平吧，连院线都上不去。很多搞笑桥段，慢动作，镜头扭转这些技巧，都是直接照抄美国动画片。中国故事，却充斥各种西方风格的笑料，没有个性创新不说，看上去也很违和。不知道为什么给那么高的分。顺便说一句，英文配音超可爱的。感觉看了英文版，反而比中文版违和感觉要小。,2.0,29,FluorineSpark,26794435,0,Negative,哪吒之魔童降世
没有自杀报复的哪吒和被抽了筋的龙一样,3.0,41,咕哒政可可,26794435,2,Neutral,哪吒之魔童降世
真想一厢情愿地认为这是封神宇宙的开端,5.0,46,EAZIN,26794435,1,Positive,哪吒之魔童降世
虽然这部电影的本意不在此，可是李靖和哪吒之间改成了和谐美满的父子关系，这故事原有的基调差不多就等于是毁了——当然，你可以说，就是想走出老版那种阴沉基调讲一个全新的美式的对抗众人刻板偏见的青春成长电影。（但是西皮还是可以磕一磕,0.0,35,.,26794435,0,Negative,哪吒之魔童降世
在重庆的影院 人们随着太乙真人的四川普通话哈哈大笑  这样就很好啦   （当然我还是更喜欢经典版本的哪吒  那才是“我不连累你”和“不认命”的真正模样 在我心里 哪吒和大圣是比哈姆雷特还伟大的悲剧形象,4.0,34,小伙锅,26794435,1,Positive,哪吒之魔童降世
熊孩子恐惧症患者慎入,4.0,37,仲曰,26794435,1,Positive,哪吒之魔童降世
我看哪吒，就是抱着观察代沟的角度去看的。因为票圈零星金句所代表的片子主题，不出我所料，一定会打动网络时代活在众人（庸众）普世价值观“无所不在凝视”之中、想要喘口气做回自己（有没有自己另说）的乖顺年轻人的心灵。片子把这个故事所蕴含的原本直刺中国传统文化中最隆重的父母与孩子关系的惨烈故事，柔化成了带入感极强、（小）中产、乖孩子主流心态的父母关系中，做自己，善战胜恶，父母、师傅为孩子奋不顾身………一部不错的主流商业片，为了支持国产动画片，我不后悔花钱买票进影院。对我来说最有趣的，是观察今天能说服年轻人的场景想象、像素精度，以及中国动画片如何在迪士尼和日漫夹击中慢慢摸索自己审美语言的那个过渡………,3.0,25,fwb,26794435,2,Neutral,哪吒之魔童降世
看预告时，我以为丑是最大的雷点；看完电影，丑是最无关紧要的ooc。这个故事和哪吒毫无关系，那个小混混我也绝对不认。,2.0,361,七幺幺没有七,26794435,0,Negative,哪吒之魔童降世
电影中有很多令人感到不适的关于屎尿屁的低俗笑料，还有一个胡子拉碴的娘娘腔🤢，太乙真人变成了令人厌恶的胖子，还生怕大家没有把他和猪想到一起，给他量身定做了一个猪当坐骑🙄。各种魔改哪吒及相关人物的设定，哪吒从灵珠子转世变成魔丸转世，从清秀的美少年变成了一个长着黑眼圈鲨鱼牙的熊孩子，以前不管在哪个版本里面都是哪吒鲨了敖丙，现在变成了哪吒和敖丙手拉手好朋友，甚至在某种程度上相当于孪生兄弟，李靖从一个厌恶哪吒甚至导致了哪吒自鲨的父权角色变成一个深爱哪吒的好爸爸，和哪吒父慈子孝，把哪吒的故事核心内容都删完了，哪吒最终还能自己解锁三头六臂的法相，导演的脑洞真是令人佩服😅😵😫,1.0,77,兰章玉砚,26794435,0,Negative,哪吒之魔童降世
精致，也抓人，但观感微妙。迪士尼拍出这个可以给五星，中国人不行，中国人知道哪吒到底是怎么回事，不管怎么感人，哪吒能给爹学背书吗？,3.0,106,Eureka A.O.,26794435,2,Neutral,哪吒之魔童降世
和喜欢这个的人坐不到一桌，就算特效做再好剧本烂也是烂片,1.0,73,口袋纽特,26794435,0,Negative,哪吒之魔童降世
戏说不是胡说，改编不是乱编。动作打斗行云流水一气呵成，技术层面也几乎无可挑剔，最主要的是这次的故事比之前的几部国产动漫都扎实了不少，没有糊弄观众。对权利的解构和重塑，阴阳善恶双生双克的设定，以及对“宿命论”的彻底颠覆，这跟《悟空传》里的空喊口号又不一样，笑点燃点都抛得恰到好处，对于人物性格和神态的塑造也十分得体且合乎情境。很乐于见到华语电影人/动画人对“封神”这个奇幻大IP下手，恭喜彩条屋终于硬气了一回。三星半，加半星鼓励。,4.0,47,朝阳区妻夫木聪,26794435,1,Positive,哪吒之魔童降世
身为哪吒爱好者有些不能忍受这么多周星驰梗的化用，伴随主题上完全的悟空化，私心减一分。不仅是哪吒敖丙的正邪对立在中途来回180度翻转，李靖乃至百姓等人的立场也完全摇摆不定，剧情完全服务于个人鸡汤励志主题，相比起来，一反剔骨割肉的李氏一家相亲相爱反而还显得比较无可厚非了，毕竟是父母出票钱带小孩来的，你还能让他们演什么呢？,3.0,20,离净语,26794435,2,Neutral,哪吒之魔童降世
十星！！！！都去看好吗！！！！！！（喊到破音！！！）,5.0,35,张春[阿卡纳],26794435,1,Positive,哪吒之魔童降世
很成熟很好看的作品啊。美术，制作，人物塑造我都很喜欢。,4.0,61,邓安庆,26794435,1,Positive,哪吒之魔童降世
“我命由我不由天”，可是后面跟着一句“这是爹教我的道理”。搞笑学周星驰，画虎不成反类犬。台词与配音都不行，尤其解释性台词过多，颇碍观感。特效做起来了，但本质商业视觉奇观与游戏化，还很土。人物立不起来，要么脸谱化要么智商捉急。当然，最恶心的自然是价值观了。将“剔骨还父”改成“二十四孝”，怕是真正意义上对中国传统的回归。而我厌恶憎恨这传统，要我就改成哪吒弑父成魔。元始天尊真垃圾，一开始灭掉那个魔丸不就没事了嘛，整部片就是一部无聊闹剧。还有，在周氏喜剧里出现如花就算了，二三十年过去了，外表壮汉般的娘娘腔在电影里依然作为笑料陪衬，主创们都给我去死，请别再消费LGBTQ群体。我错了我就不该看的我真的再也不看国产片了操。,1.0,66,赛林,26794435,0,Negative,哪吒之魔童降世
"三星剧情，五星的制作。四星平均。
我非常非常反感最后一幕所有百姓跪在地上的情节，让我想起美恐 cult那一部，制造恐怖，然后制服它，大众归顺与你。
比美恐更甚的是，这一部居然大众还下跪了。服了。",4.0,25,亲爱的桂花树,26794435,1,Positive,哪吒之魔童降世
技术上很成熟了但是…,3.0,94,我对你的无语简直能沉默整个宇宙,26794435,2,Neutral,哪吒之魔童降世
太乙真人骑着猪做丑角？李靖哪吒父慈子孝？削骨还父削肉还母呢？哪吒敖丙组cp？要搞国潮超英动画捞钱，你有本事原创IP和人物啊，魔改经典算什么好汉？而且，把反父权大旗改成我命由我不由天的鸡血口号，心地是大大的坏——很多后浪以后就只认这个哪吒了。,2.0,38,小广,26794435,0,Negative,哪吒之魔童降世
三星，前半段三星，后半段四星。,4.0,19,艾晨,26794435,1,Positive,哪吒之魔童降世
技术完美。但我觉得“哪吒”是一个“我不要”“还给你”的人物，而不是吒儿这样和解、回归、圆满的角色……,4.0,34,隔壁家的桃太太,26794435,1,Positive,哪吒之魔童降世
剧情真的很弱智。,2.0,47,屠椿,26794435,0,Negative,哪吒之魔童降世
粗俗过了。,1.0,44,crusader,26794435,0,Negative,哪吒之魔童降世
再一次警告中国电影人，不准这样做电影了！不然还得花电影票钱！不可以！要坚持做烂片，不要又逼我花钱走进电影院！,4.0,27,阿巴厮,26794435,1,Positive,哪吒之魔童降世
虽然这个身份政治故事前半段也蛮好看，尤其哪吒的神态很传神，但这不是真哪吒，我还是无法接受不弑父的哪吒和父爱如山的李靖。大荧幕上是不是再也不允许弑父了？这个电影再次证明我们所有人都被阉割了，因为连力比多的化身永恒的少年哪吒都被阉割了，变成了古希腊悲剧人物和迪斯尼英雄🤷♀️,3.0,14,drunkdoggy,26794435,2,Neutral,哪吒之魔童降世
"我一直觉得中国古代神话能称得上传奇的只有两个人物
一是猴子 一是哪吒
百世蕴灵育出只石猴 大闹天宫腾云驾雾
三年怀胎生了个哪吒 东海屠龙翻江倒海
可以说 除了这两人 没人再能当得起离经放纵四个字的
但称得上悲剧的 约摸也只有这两个
一个五行山下压五百年 揭了封印 戴上金箍无悲无喜 拜佛西天 唤孙悟空
一个削肉还母剔骨还父 塑了莲身 站上火轮无怨无恨 封神南门 号三太子
这尘世最擅长的事 大抵就是抹杀疏狂者的落拓 磨平豪纵者的傲骨 斩灭叛世者的孤妄",5.0,53,听说爱很美味,26794435,1,Positive,哪吒之魔童降世
华夏是孝道文化，但哪吒闹海是我的最爱：骨肉还给你，人格、精神永远独立。任何文化唯有保持对峙的紧张状态，才有可能革新、前进，歌颂父权是什么鬼？这不是我的哪吒，这是向钱看的辣鸡，负分滚粗,1.0,225,西风独自凉,26794435,0,Negative,哪吒之魔童降世
不好看，不要浪费时间。画面制作再精美，也只是表现形式。国内不会再有描述人性的好作品了，政治干预太严重。原本对天地君亲师的反叛，变成了亲情友情包围下对命运的挣扎。,2.0,190,陌生的天花板,26794435,0,Negative,哪吒之魔童降世
犯了和陈凯歌版赵氏孤儿一个毛病，把原著里最激烈的人性冲突给剔除了。,3.0,32,贝果在唱歌,26794435,2,Neutral,哪吒之魔童降世
此评价代表一位刚陪一位沉迷西游记数月的五龄童看完电影的老父亲的感受。孩子笑得开心，为父老泪纵横。,5.0,62,大头绿豆,26794435,1,Positive,哪吒之魔童降世
从商业的角度来说，这部《哪吒》是非常出色的。毫无门槛的故事让这部电影适合每一个人，与命运抗争的主题与亲情等主流价值观元素的调剂，让这部《哪吒》的火热成为必然。可是这也让电影变得十分烂俗且流于表面，像是一篇没什么水平的起点网文。作为一个79版《哪吒闹海》的忠实粉丝，看到哪吒这个角色本身所带着的反抗父权的寓意和革命性在这部电影中被剧作上的主流价值观所消解的时候，心里还是很不是滋味的。哪吒这个角色不该是单纯的叛逆的象征，哪吒的父母也并不只是一对苦口婆心的父母那样简单。1979年时，《哪吒闹海》横空出世。彼时的主流动画作品，如《大闹天宫》和那部《哪吒闹海》，都带着那个时代独有的“与天奋斗”的革命色彩。尤其是《大闹天宫》颠覆性的将结局改成了天庭被推翻。而这部从各角度来看都实在是太...迪士尼了。,2.0,35,伊苏林迪竹节虫,26794435,0,Negative,哪吒之魔童降世
陪孩子看完。别的不谈，叙事层面真的比不过79年的《哪吒闹海》，那一版人物性格分明，情节发展脉络清晰，且同样是反抗主题，79版电影反抗的对象是清清楚楚的。然而这版里的哪吒到底在反抗什么？感觉从开始到结束一直在变来变去，只有母慈子孝反而被演绎得比较生动。其实从哪吒这个人物形象的变化中，是可以看出很多问题的，比如编剧如何处理“异质的存在”？至少在这版中，我看到的是被天命异质化的哪吒在不断希求被主流接纳，这其实是一种非常保守（平庸）的态度。40年过去，这就是改开的阶段性成果吗？,3.0,22,黑伞,26794435,2,Neutral,哪吒之魔童降世
皮相做的还不错，观感体验也还行，但是依然没有真正吸引人的内核。动漫最吸引人的东西恰恰缺席了。,2.0,191,小四川,26794435,0,Negative,哪吒之魔童降世
太棒了👏有智商 有逻辑 有意思 希望票房大爆！改编的颠覆又相当合理，冲突和感情都不平面，感觉很多部分有漫威的影子。,5.0,65,Cosine 万一,26794435,1,Positive,哪吒之魔童降世
真是过誉啊，技术和预算都比《大圣归来》高了不少，但缺了《大圣》最成功的那一股劲儿。谁也不敢得罪，又把故事做得太复杂，一口气出不来。如果能爆，也只能归功于这个撤片档实在没片看吧。,3.0,163,SydneyCarton,26794435,2,Neutral,哪吒之魔童降世
周星驰式幽默是将搞笑段子甚至金句穿插在它注定应该属于的地方，而不是那样毫无章法的堆砌和滥用，网络用语和段子的大量使用削弱了原本古代背景的合理性，是一种极其讨巧的心思，打着迎合大众的恶趣味来达到现象级作品的目的，忽视了一个作品应该有的那些基本要求，这是对自己和对观众双方的不负责。,1.0,224,滿神的異教徒,26794435,0,Negative,哪吒之魔童降世
单看故事感觉还可以，但是放在哪吒这个人物身上，这个改编其实是舍弃了人物身上最大的悲剧性的,3.0,42,Hey LIoyd,26794435,2,Neutral,哪吒之魔童降世
电影交流会上一派喜气洋洋的氛围。导演说让这部电影成为国漫崛起的代表，而我觉得最多凑个国漫复兴，血统不纯何谓“国漫”？另外只有我一个人觉得电影三观扭曲吗？主角形象另说，台词轻浮，情节丑恶低下：百姓因恐惧哪吒装死跳进真棺材，逝者横尸大街还抢人家符咒？？放屁没完没了还要反派没完没了吸？？娘炮和残疾人也能没完没了搞笑？这部电影我果断不能买单。,2.0,257,里里里里奥,26794435,0,Negative,哪吒之魔童降世
与其说“表达xx”不如说“如何快速令人以为我们在表达xx”，一部不曾构建任何东西的混乱非电影,1.0,36,╲│┼│╱,26794435,0,Negative,哪吒之魔童降世
自古红蓝出CP！虽然对“我命由我不由天”这种主题还蛮疲劳的~｜电审动字［2019］018号,4.0,43,Nemooo,26794435,1,Positive,哪吒之魔童降世
